{
  "$schema": "https://json-schema.org/draft/2020-12/schema",
  "$id": "https://wake-studio.dev/model-registry.schema.json",
  "title": "WakeStudio model registry",
  "description": "Catalog of lazily-fetched models (ADR-011). Weights are never bundled with the PWA; the registry is the single source of truth for 'what model should be present locally' and drives the Phase 4 export license gate. Mirrors packages/platform/src/registry.ts (RegistryModel / ModelRegistry).",
  "type": "object",
  "required": [
    "version",
    "updated",
    "models"
  ],
  "properties": {
    "version": {
      "type": "integer",
      "minimum": 1,
      "description": "Registry format version (bump on breaking shape changes)."
    },
    "updated": {
      "type": "string",
      "pattern": "^\\d{4}-\\d{2}-\\d{2}$",
      "description": "Last-update date (ISO yyyy-mm-dd)."
    },
    "note": {
      "type": "string",
      "description": "Human note about the registry (e.g. the lazy-fetch / license-gate policy)."
    },
    "models": {
      "type": "array",
      "minItems": 1,
      "items": {
        "$ref": "#/$defs/registryModel"
      }
    }
  },
  "$defs": {
    "registryModel": {
      "type": "object",
      "description": "One lazily-fetched model. Field set mirrors RegistryModel in packages/platform/src/registry.ts.",
      "required": [
        "id",
        "name",
        "tier",
        "source",
        "url",
        "format",
        "license",
        "commercial",
        "class",
        "sha256",
        "sizeBytes"
      ],
      "properties": {
        "id": {
          "type": "string",
          "pattern": "^[a-z0-9]+([_-][a-z0-9]+)*$",
          "description": "Unique registry id (kebab/snake case), e.g. 'melspectrogram', 'hey-buddy', 'plixkws-small'."
        },
        "name": {
          "type": "string",
          "description": "Human-readable model name."
        },
        "tier": {
          "type": "array",
          "minItems": 1,
          "items": {
            "enum": [
              "low-power",
              "high-performance"
            ]
          },
          "description": "Target device tiers this model supports (ModelTier)."
        },
        "source": {
          "type": "string",
          "description": "Origin / upstream repo of the model, e.g. 'dscripka/openWakeWord'."
        },
        "url": {
          "type": "string",
          "description": "Fetch URL. Module-owned assets use '/modules/<category>/<module>/assets/<rel>' (ADR-025); remote models use a full URL. 'TODO-phaseN' marks models not yet fetched."
        },
        "format": {
          "enum": [
            "onnx",
            "tflite",
            "wasm",
            "other"
          ],
          "description": "Model / artifact binary format."
        },
        "license": {
          "type": "string",
          "description": "SPDX-style license id (e.g. 'Apache-2.0', 'MIT', 'CC-BY-4.0'). Drives the export license gate."
        },
        "commercial": {
          "type": "boolean",
          "description": "Whether commercial use is permitted (drives the Phase 4 export gate)."
        },
        "class": {
          "enum": [
            "redistributable",
            "demo-only"
          ],
          "description": "Redistribution class (ModelClass): 'redistributable' = can be exported into user kits; 'demo-only' = demo purposes only (e.g. CC BY-NC-SA openWakeWord models)."
        },
        "sha256": {
          "type": [
            "string",
            "null"
          ],
          "description": "Artifact integrity hash; 'TODO-phaseN' until verified (ADR-027). Null when unknown."
        },
        "sizeBytes": {
          "type": [
            "integer",
            "null"
          ],
          "minimum": 0,
          "description": "Artifact size in bytes; null when unknown."
        },
        "runtime": {
          "enum": [
            "onnx",
            "transformers",
            "wasm"
          ],
          "description": "Execution runtime hint (ModelRuntime). Optional; onnxruntime-web is the default."
        },
        "encoderVariant": {
          "enum": [
            "base",
            "small"
          ],
          "description": "PLiX encoder variant ('base' | 'small') when format === 'onnx'."
        },
        "transformersModel": {
          "type": "string",
          "description": "Hugging Face repo id for the transformers runtime (e.g. 'aaqibsaeed/plixkws')."
        },
        "embeddingDim": {
          "type": "integer",
          "minimum": 1,
          "description": "Embedding dimensionality (PLiX = 1280 for all variants)."
        },
        "externalData": {
          "type": "string",
          "description": "For ONNX external-data exports: the co-located .data file name (e.g. 'plixkws-small.onnx.data')."
        },
        "notes": {
          "type": "string",
          "description": "Human note (source detail, runtime behavior, fetch instructions)."
        },
        "manifestUrl": {
          "type": "string",
          "description": "Sidecar manifest URL for models that need one (kws-streaming: model.json declaring tensor names, labels, window/packet geometry). See docs/modules/kws-streaming.md §4.2."
        },
        "accuracy": {
          "type": [
            "number",
            "null"
          ],
          "description": "Reported top-1 accuracy in percent on the model's own eval set (provenance for the UI; e.g. 97.61 for kwt1 on Speech Commands V2 12-label)."
        }
      },
      "additionalProperties": false
    }
  }
}
