{
  "$schema": "./model-registry.schema.json",
  "version": 1,
  "updated": "2025-01-01",
  "note": "Catalog of lazily-fetched models (ADR-011). Weights are never bundled. Each entry's 'license' and 'commercial' fields drive the Phase 4 export license gate.",
  "models": [
    {
      "id": "melspectrogram",
      "name": "openWakeWord melspectrogram (16 kHz log-Mel front-end)",
      "tier": ["low-power", "high-performance"],
      "source": "dscripka/openWakeWord",
      "url": "/prebuilts/openWakeWord/melspectrogram.onnx",
      "format": "onnx",
      "license": "Apache-2.0",
      "commercial": true,
      "class": "redistributable",
      "sha256": "TODO-phase2",
      "sizeBytes": 1087958,
      "notes": "openWakeWord Mel front-end (Apache-2.0); 16 kHz log-Mel. Byte-identical to the hey-buddy re-host. Served from local prebuilts in dev (ADR-011 amendment)."
    },
    {
      "id": "speech_embedding",
      "name": "Google speech_embedding backbone (re-implemented in openWakeWord)",
      "tier": ["low-power", "high-performance"],
      "source": "dscripka/openWakeWord (re-impl of google/speech_embedding)",
      "url": "/prebuilts/openWakeWord/embedding_model.onnx",
      "format": "onnx",
      "license": "Apache-2.0",
      "commercial": true,
      "class": "redistributable",
      "sha256": "TODO-phase2",
      "sizeBytes": 1326578,
      "notes": "Google speech_embedding backbone re-implemented in openWakeWord (Apache-2.0, ~1.4M params). Byte-identical to the hey-buddy re-host. Local prebuilt."
    },
    {
      "id": "hey-buddy",
      "name": "Hey Buddy wake-word model (hey buddy)",
      "tier": ["high-performance"],
      "source": "benjamin-paine/hey-buddy",
      "url": "https://huggingface.co/benjamin-paine/hey-buddy/resolve/main/models/hey-buddy.onnx",
      "format": "onnx",
      "license": "CC-BY-4.0",
      "commercial": true,
      "class": "redistributable",
      "sha256": "TODO-phase2",
      "sizeBytes": 1186048,
      "notes": "Browser-first wake-word model. Commercially clean (CC-BY-4.0). Replaces the CC BY-NC-SA openWakeWord alexa demo model."
    },
    {
      "id": "plixkws",
      "name": "PLiX Few-Shot encoder (base / small)",
      "tier": ["high-performance"],
      "source": "aaqibsaeed/plixkws (ONNX export of FewshotML/plix)",
      "url": "/prebuilts/plixkws/plixkws-base.onnx",
      "format": "onnx",
      "license": "Apache-2.0",
      "commercial": true,
      "class": "redistributable",
      "sha256": "TODO-phase3",
      "sizeBytes": null,
      "notes": "Compact CNN (EfficientNet-v2 'base' / TinyNet-E 'small') trained as a Prototypical Network; outputs a 1280-dim embedding for prototype-distance matching. Replaces WavLM-base-plus as the Few-Shot encoder (WavLM was too heavy for end-side devices). Apache-2.0 (FewshotML/plix). The published weights are PyTorch .pt (Dropbox); export to ONNX via torch.onnx and drop into prebuilts/plixkws/. Local prebuilt."
    },
    {
      "id": "silero-vad",
      "name": "Silero VAD (voice activity detection)",
      "tier": ["low-power", "high-performance"],
      "source": "snakers4/silero-vad",
      "url": "/prebuilts/openWakeWord/silero_vad.onnx",
      "format": "onnx",
      "license": "MIT",
      "commercial": true,
      "class": "redistributable",
      "sha256": "TODO-phase1",
      "sizeBytes": 1807522,
      "notes": "Gates KWS to reduce compute and false alarms. Local prebuilt (bundled in openWakeWord release). Not loaded in v1 (RNNoise VAD is used, ADR-018)."
    },
    {
      "id": "microwakeword-demo",
      "name": "microWakeWord demo model (e.g. 'okay_nabu')",
      "tier": ["low-power"],
      "source": "esphome/micro-wake-word-models",
      "url": "TODO-phase2",
      "format": "tflite",
      "license": "Apache-2.0",
      "commercial": true,
      "class": "redistributable",
      "sha256": "TODO-phase2",
      "sizeBytes": null,
      "notes": "Used as a browser-demo MCU model until Phase 5 trains a WakeStudio-owned word."
    }
  ]
}
